id,name,standard,ownerId,dataSourceId,locale,inapplicable,lastChangeDate,lastPublishDate,order,selected,note,dataSourceCitation,published
a7a748a8-15aa-439e-8664-f024950728d7,Gemiddelde bruto maandlonen voor voltijds tewerkgestelde werknemers,True,,91eb75ea-9839-4b36-aa48-56ca412987b5,nl,False,1460452245286,1599556148104,,False,,,True
60e67d81-3523-47cb-87de-723ca67046be,Gemeenten met de hoogste werkgelegenheidsgraad van 20-64-jarigen,True,,06deb4bd-8f91-49fb-befb-cfb25108b5ae,nl,False,1455709310277,1463142504174,,False,,,True
c0d567a1-9ce7-475b-8fc5-9659d0333f89,"Index van de aankoopprijzen van de productiefactoren in land- en tuinbouw voor België, laatste 6 jaar",True,,cbc32a6a-b047-47b2-b8f5-22293ca5025d,nl,False,1615197764441,1636367859642,,False,,,True
04574b61-75ef-499f-80b2-a8ff24d30d2d,Table from HC07_1 (NL),True,,949f8596-b42d-4262-94bf-c5949ef71bbf,nl,False,1443454620632,1452606453190,,False,,,True
81f949c1-fc20-4554-bf0d-84e8eda70dce,"Afzetprijsindexen voor de industrie (zonder bouw) voor de binnenlandse markten, deelindexen voor materiaalkosten in de bouw, laatste 13 maanden",True,,69139733-0349-4d6b-b54c-ae78cb7f6a90,nl,False,1443454620632,1456316168497,,False,,,True
811fd98a-72db-4a30-99b6-12c338eaf167,"Aandeel van de bewoonde conventionele woningen gebouwd vóór 1919: België, de gewesten en de provincies",True,,06deb4bd-8f91-49fb-befb-cfb25108b5ae,nl,False,1455715556121,1463141782453,,False,,,True
f1659db6-4e1c-46dd-bf17-0a99492fb23a,Table from HC12_1 (NL),True,,51f01bdd-0955-4144-8378-c460ba7d7414,nl,False,1443454620632,1452614377659,,False,,,True
14c71538-3b61-4c8c-9d09-c11ef1dd516a,Table from HC02_1 (NL),True,,2e53514c-77dc-4608-8a0c-fab7e4369b2d,nl,False,1443454620632,1452603148793,,False,,,True
32963d35-c749-440b-bfb5-953c56b52a4f,"Armoederisico, België, laatste zes jaren",True,,7b94e1eb-47c5-419e-90cc-625748389fb3,nl,False,1456154255160,1560500270583,,False,,,True
d1753c73-182a-4a32-8ece-663a3915ec67,Gemeenten met het grootste aandeel woningen bewoond door de eigenaar,True,,06deb4bd-8f91-49fb-befb-cfb25108b5ae,nl,False,1455714652570,1463142591575,,False,,,True
90c16f67-23de-4e38-beb3-d2a0b521a1cf,Gemeenten waarvan het aandeel van de bevolking dat in het buitenland verbleef het laagst was,True,,06deb4bd-8f91-49fb-befb-cfb25108b5ae,nl,False,1455713923430,1463142735381,,False,,,True
959e1558-fa46-4d5d-b12f-212366d4dbe7,Table from HC26 (NL),True,,d9afdc25-56eb-44d9-ba41-4127162d15c8,nl,False,1443454620632,1452675019191,,False,,,True
4a912cfb-ef68-42fc-aa99-9d324b652d85,Zuivelproducten op basis van andere melk dan koemelk - laatste 10 jaren,True,,96ee1626-227b-4497-b54c-f18f74774415,nl,False,1443454620632,1591874619755,,False,,,True
ca552835-6319-4825-bf78-7bc12bb09cfe,Gemeenten met het hoogste aandeel vreemdelingen met een nationaliteit van een land van de Europese Unie,True,,06deb4bd-8f91-49fb-befb-cfb25108b5ae,nl,False,1455710817098,1463142591575,,False,,,True
109e3a4e-e03b-42a9-a5a2-720b66a69ba2,"Indexcijfer van de huizenprijzen, weging van de laatste 8 jaar",True,,f1308b2b-3791-4495-ba2a-4168c50e666b,nl,False,1464354386323,1655969503820,3.0,False,,,True
16d7e29c-d62d-45b9-a92b-8cd9bb0e8c0f,Bodemgebruik in België vanaf 1980,True,,a6d46aff-ad9a-4bab-a829-d8ab96d98173,nl,False,1663054296459,1663054679174,,False,,,True
0c56bcab-36d6-4aa0-9d1c-da51850e7c67,Gemeenten met het laagste aandeel gehuwden,True,,06deb4bd-8f91-49fb-befb-cfb25108b5ae,nl,False,1455696043433,1463142631860,,False,,,True
8f489ab9-b7a4-414f-bd81-50f96ceba839,Gemeenten met de hoogste geslachtsverhouding,True,,06deb4bd-8f91-49fb-befb-cfb25108b5ae,nl,False,1447836450378,1463142504174,,False,,,True
3437f59a-427d-4558-9277-463f8733ef4a,"Aantal actieve btw-plichtige ondernemingen volgens rechtsvorm en plaats maatschappelijke zetel, meest recente jaar",True,,17ff6a79-d690-4e83-bfd6-a22a71c23785,nl,False,1447082377245,1664956232261,,False,,,True
2ada4657-a41f-4b39-bfea-94b4898b0bba,"Aandeel koppels zonder kinderen : België, regio’s, provincies",True,,06deb4bd-8f91-49fb-befb-cfb25108b5ae,nl,False,1455695062253,1463141684903,,False,,,True
79322c7c-8b8a-4bbf-ac87-6af0f2154b9c,"Aandeel loontrekkenden: België, gewesten, provincies",True,,06deb4bd-8f91-49fb-befb-cfb25108b5ae,nl,False,1455696518513,1463141684903,,False,,,True
0859950c-50e4-4e39-acde-bc48f47215a5,"Mediaanprijs van de verkopen van gewone woonhuizen per gemeente, arrondissement, provincie en gewest, 1992, 2000, 2005, 2010, 2015, 2017 en 2018",True,,9a3c3549-08f3-4de0-8d58-f270fcd7beec,nl,False,1630936625577,1630937679407,,False,,,True
99bade38-fb0f-48b4-894d-52a00caa51b9,"Werkgelegenheids-, werkloosheids- en activiteitsgraad per geslacht voor België en Gewesten, laatste 4 kwartalen",True,,74040495-26bf-4df2-a474-6a875cf58cb2,nl,False,1525703736777,1525703756715,0.0,False,,,True
09de639d-668b-41fb-b8ec-eb82b3546407,Gemeenten met de grootste bevolking,True,,06deb4bd-8f91-49fb-befb-cfb25108b5ae,nl,False,1453815316751,1463142477741,,False,,,True
0296c87d-0133-4085-b7b7-bd52491e4a4a,Table from HC01_4 (NL),True,,f806530b-d41f-48d4-8099-e4769195d5cc,nl,False,1443454620632,1452584692701,,False,,,True
b29a9e0b-4be5-4105-aa5c-a4bd958ccf8f,"De consumptieprijsindex sinds 1920 volgens basisjaar, laatste 13 maanden",True,,da09b8ad-46d0-4fff-9f92-b95bcb5e25d7,nl,False,1447067272647,1450362174336,,False,,,True
613577f3-e873-4b6b-8f2b-1fa8795d7e95,Gemeenten met het laagste aandeel éénpersoonshuishoudens,True,,06deb4bd-8f91-49fb-befb-cfb25108b5ae,nl,False,1455710657099,1463142677940,,False,,,True
b894815d-1db6-4dab-8c71-d2e4b3404edc,Table from HC44_1 (NL),True,,ebdf6d54-9722-4cf8-915e-d097ea96453e,nl,False,1446817219588,1452675860958,,False,,,True
8e5ebc9e-2d4f-4edd-a0a9-0f9f67e4a2e3,Table from HC09_3 (NL),True,,74ac225b-c5e5-4605-a93e-23a48ee7e090,nl,False,1452613955176,1452614120451,,False,,,True
b3c5aa7c-9e74-4dae-88c7-2e834cf8a33f,"Weging van de producten en diensten voor de geharmoniseerde index van de consumptieprijzen, laatste 10 jaren",True,,ca6de3b0-e6c1-4c66-8a3a-f608497d5ac5,nl,False,1564034266900,1618472841528,,False,,,True
47c6541a-0354-42aa-bca9-563de98e920b,Table from HC53 (NL),True,,ea68ed09-6dbd-4a33-beb6-b265e183e5bd,nl,False,1447762599919,1452677360879,,False,,,True
484b00b2-4cf2-40b0-89ee-696a30aa4fa5,"Gemiddeld officieel tarief van de aardolieproducten in euro, laatste 24 maanden",True,,2cbb788b-2c1b-4499-af1e-2d0c99eea006,nl,False,1529323398893,1547224157247,,False,,,True
c7cba5dc-ec2c-433c-9594-99bd8f184d0e,"Ontvangst van koemelk, hoeveelheid, vet en eiwitgehalte, laatste 9 maanden",True,,53d457c5-94e9-474f-b01b-2ecc794a5197,nl,False,1545053279833,1591874619755,,False,,,True
e6536262-594e-495d-8b9c-f0518a92d67a,Gemeenten waar het aandeel van de bewoonde conventionele woningen gebouwd vanaf 2001 het laagst is,True,,06deb4bd-8f91-49fb-befb-cfb25108b5ae,nl,False,1455715487273,1463142735381,,False,,,True
c7ec8263-a3dd-4f37-a289-7854541f7c63,"Aandeel zelfstandigen: België, gewesten, provincies",True,,06deb4bd-8f91-49fb-befb-cfb25108b5ae,nl,False,1455696603624,1463141855233,,False,,,True
656a2651-d2d7-486f-8bc6-d6ab65ac6a75,"Aantal stopzettingen van btw-plichtige ondernemingen volgens rechtsvorm en plaats maatschappelijke zetel, meest recente jaar",True,,17ff6a79-d690-4e83-bfd6-a22a71c23785,nl,False,1447143170810,1664956232261,,False,,,True
6a1ec0c6-fabb-4f32-8e94-05f0f03a3f05,"Aandeel buitenlanders: België, regio’s, provincies",True,,06deb4bd-8f91-49fb-befb-cfb25108b5ae,nl,False,1447148219900,1463141654561,,False,,,True
6017c6f1-d711-49cd-aa24-6c6cd910c5ad,Table from HC03_1 (NL),True,,b6edf267-726c-42a9-89b6-304ef6ae7e62,nl,False,1443454620632,1452604957802,,False,,,True
ddc7e47e-ff34-4624-a98b-3ebebc1410d1,Table from HC28 (NL),True,,275077b5-df6e-40c6-9575-2395a87055a8,nl,False,1443454620632,1452675082821,,False,,,True
49bd73c0-6b27-422b-a3c7-bdbdd7e8193c,"Activiteitsgraad van 15-64-jarigen: België, gewesten, provincies",True,,06deb4bd-8f91-49fb-befb-cfb25108b5ae,nl,False,1455709749287,1463142363742,,False,,,True
e5d34be9-82c1-4191-b177-7f883e4ed6ba,Gemeenten met de laagste geslachtsverhouding,True,,06deb4bd-8f91-49fb-befb-cfb25108b5ae,nl,False,1447836600875,1463142553814,,False,,,True
80233119-f72e-4d0c-a294-eb7d2156a806,Table from HC45 (NL),True,,fd744af4-feb4-4889-936f-0800f31df6f4,nl,False,1446817534574,1452675860958,,False,,,True
f971f22c-86de-4f44-94e6-6c1f15032595,"Omzet volgens de btw-aangiften per economische activiteit (NACE 2008), België, 2 laatste jaren",True,,095cb5e3-a398-4372-8f30-3f9d96b3abd7,nl,False,1582895966763,1662105569032,,False,,,True
81af2f57-4238-4824-a223-c54a3c2f9489,"Banenverlies volgens grootteklasse, laatste 13 maanden",True,,afdecf03-f4dd-4e0f-9a8d-faa55be83259,nl,False,1560328915050,1674117171099,,False,,,True
db7280da-00c6-48dd-bc88-99a11181d46f,Table from HC06_6 (NL),True,,9ab474b2-395f-4f3e-8601-7318f7a732bf,nl,False,1452456755105,1452605954491,,False,,,True
3cbe2e1a-30d5-460f-a632-5f6050ab0efd,Gemeenten met het hoogste aandeel koppels zonder kinderen,True,,06deb4bd-8f91-49fb-befb-cfb25108b5ae,nl,False,1455695169539,1463142591575,,False,,,True
800863d8-d5ec-40ff-9add-c42fb4cca782,"Aantal oprichtingen van btw-plichtige ondernemingen volgens economische activiteit en plaats maatschappelijke zetel, meest recente jaar",True,,17ff6a79-d690-4e83-bfd6-a22a71c23785,nl,False,1447143263397,1664956232261,,False,,,True
50215a9c-3b03-40ef-b443-48814c646ab4,Table from HC19 (NL),True,,f7fa1111-a328-454f-95f3-6c258f522754,nl,False,1443454620632,1452674448978,,False,,,True
e4bcf725-1708-4bb2-aa27-df1c69b010bb,Actieve onderneming naar grootteklasse van het aantal werknemers,True,,94ecc518-2e49-402f-beb9-f8224c747b60,nl,False,1620811901401,1620812494155,,False,,,True
e2cea6ce-a456-4223-a419-2c12cce00c12,"Armoederisico bij alleenstaanden voor België, 2018",True,,7b94e1eb-47c5-419e-90cc-625748389fb3,nl,False,1560498025227,1560500270583,-3.0,False,,,True
cb4992ba-d6de-453b-bad8-6644a310c6c2,"Aandeel vreemdelingen met een nationaliteit van een land van de EU27: België, regio’s, provincies",True,,06deb4bd-8f91-49fb-befb-cfb25108b5ae,nl,False,1463142215227,1463142287498,,False,,,True
8594fb2a-9b0a-4f04-8207-2e5f7fbd124d,Table from HC40 (NL),True,,2e7f72e8-d533-4cb2-aeaa-04a6de939591,nl,False,1446730490421,1452675551305,,False,,,True
6ef93575-5e03-4c6b-9212-504b81be7995,"Aantal particuliere huishoudens : België, regio’s, provincies",True,,06deb4bd-8f91-49fb-befb-cfb25108b5ae,nl,False,1453816274328,1463142384158,,False,,,True
a17a3b4b-95ea-4c82-893e-bd59863cfa90,Werkgelegenheidsgraad en werkloosheidsgraad,True,,f0487d44-2b45-427c-b2ce-890196a728c4,nl,False,1538475015054,1664284473589,0.0,False,,,True
1d6ac3ec-16ff-4bb9-ba33-2b9ebeb547a9,Gemiddelde bruto maandlonen voor voltijds tewerkgestelde werknemers 2000-2020*,True,,91eb75ea-9839-4b36-aa48-56ca412987b5,nl,False,1664263981243,1664264026487,,False,,,True
888900ba-d622-4eda-9d7f-94389147e2be,Gemeenten waar de gemiddelde leeftijd het hoogst is,True,,06deb4bd-8f91-49fb-befb-cfb25108b5ae,nl,False,1455710229270,1463142677940,,False,,,True
9090f429-32f6-40c3-a685-04cef7b6b0f1,"Aantal dode, zwaargewonde, lichtgewonde en ongedeerde slachtoffers van verkeersongevallen, voor België en de gewesten, laatste 8 jaar",True,,c60f6fc7-818f-4a23-9622-524506c6b305,nl,False,1458035553473,1619079862734,,False,,,True
8b78b8f8-d351-4f38-92b5-28da0426ca1a,"Computerapparatuur van bedrijven per regio, meest recente jaar",True,,b24bd07e-6209-47ed-9822-4a503d5cb0e7,nl,False,1670487760407,1670488078899,,False,,,True
36cf0462-c195-4cd8-b1ae-2add0370ec6e,"Structuur van de ondernemingen voor de groot- en detailhandel, 2020",True,,cb66951a-04b5-4c17-963c-3faf117770b9,nl,False,1663838870417,1663839039361,0.0,False,,,True
a5f55388-f69e-447a-ab7d-c96612466f4a,"Indexcijfer van omzet voor de dienstensector (NACE 2008) volgens de btw-aangiften, laatste 5 jaren (basisjaar = 2015)",True,,1cff05d3-ed52-4892-9f30-390155f05950,nl,False,1662098210092,1662111294762,,False,,,True
03cd07d0-3ec6-4f62-be7c-5fdc2c09a3c2,Table from HC07_2 (NL),True,,fba5a4f3-4b34-41b6-875c-84d170d102e7,nl,False,1443454620632,1452606453190,,False,,,True
55a192c3-2f48-4b4d-b207-98b8ddbe2ffe,"Werkgelegenheids-, werkloosheids- en activiteitsgraad volgens onderwijsniveau per geslacht voor België en Gewesten",True,,262defc5-1607-42aa-a646-d0b4f6844d4f,nl,False,1549885963008,1549890653266,,False,,,True
1e33c9bc-20f4-4699-adff-f800da946ed9,"De consumptieprijsindex volgens verschillende basisjaren, laatste 13 maanden",True,,a956f4c1-ac3b-4f95-b7bb-a37e705f6446,nl,False,1446640905867,1548845242477,,False,,,True
9701255a-6f27-416f-85ff-dbb60051f1a3,Table from HC34 (NL),True,,e3aedf6b-289b-46bf-9512-b4b74a77c783,nl,False,1446632401312,1452675270463,,False,,,True
22dc902e-7ba9-4a90-8f63-411fff9701b8,"Detailhandel Bruto-index en tendens, laatste 4 maanden",True,,5d3c2e37-d883-41fe-8c2f-fe8768353aa6,nl,False,1622705915817,1622706809727,,False,,,True
65a57917-117b-442d-9585-95aff3ab19b9,Table from HC12_3 (NL),True,,443bc6a7-fc3d-4968-96e5-ed5415f86b86,nl,False,1443454620632,1452614377659,,False,,,True
f8a0c001-dfb6-4050-bbb0-34c6c5334e98,Gemeenten waarvan de gemiddelde grootte van de particuliere huishoudens het hoogst is,True,,06deb4bd-8f91-49fb-befb-cfb25108b5ae,nl,False,1455710108581,1463142735381,,False,,,True
6a605953-2837-4d8e-8026-afd20aa9c1f6,Table from HC31 (NL),True,,0008f4f8-9f54-4121-b230-141324cf0829,nl,False,1443454620632,1452675150695,,False,,,True
876acb9d-4eae-408e-93d9-88eae4ad1eaf,"Consumptieprijsindex, inflatie, gezondheidsindex, afgevlakte index, indexen zonder petroleum en energie, laatste 13 maanden",True,,a956f4c1-ac3b-4f95-b7bb-a37e705f6446,nl,False,1446639933493,1548845242477,,False,,,True
f884a38e-9890-4283-bcb7-bdac26a2dd0b,Stopzettingsgraad van btw-registraties (per arrondissement voor de laatste 12 maanden) NO SYNCHRO,True,,a2139242-040a-49b3-aed1-ac3628c7577b,nl,False,1615885586729,1619175476283,,False,"De stopzettingsgraad is de verhouding, uitgedrukt in %, tussen het aantal stopzettingen van de huidige maand en het aantal btw-plichtigen van dezelfde maand van het jaar ervoor.",,True
8c000d33-f325-4743-aafa-55275ef16f96,Gemeenten met het hoogste aandeel vijfenzestigplussers,True,,06deb4bd-8f91-49fb-befb-cfb25108b5ae,nl,False,1455690398110,1463142591575,,False,,,True
2a7f7c9a-d30e-4f81-8370-02cd30317009,Table from HC55 (NL),True,,ec8ecbfc-f845-4fe7-9eac-ae36cf319ec7,nl,False,1447762775174,1452677360879,,False,,,True
91cd667e-f22c-4e23-a3dd-9807796cba37,"Aantal faillissementen volgens activiteit en gewest, 2022",True,,afdecf03-f4dd-4e0f-9a8d-faa55be83259,nl,False,1674110630778,1674117171099,0.0,False,,,True
1f8738e7-50a1-457e-b67d-65303ff5d583,Slachtingen van dieren per diersoort - laatste jaar,True,,3488f928-86af-4067-92db-4fbe45c9a251,nl,False,1512556080535,1627025349062,,False,,,True
405bce12-0e56-476e-a285-c535cb399065,Geboorte per grootteklasse van het aantal werknemers,True,,94ecc518-2e49-402f-beb9-f8224c747b60,nl,False,1620812031948,1620812494155,,False,,,True
d5347e10-abaf-45d9-bc66-d3307acecb50,Energie gebruiksstatistieken - Hernieuwbare energie 2021,True,,0e22d3ca-1721-4f98-80a9-df41ab32e72b,nl,False,1671178310516,1671179230813,,False,,,True
cdca21fd-2a16-44d8-ba60-7cd8f160defc,"Mediaan prijs van de verkopen van appartementen per gemeente, arrondissement, provincie en gewest",True,,2a7528e9-8b3f-4ee5-ae67-8ebc33664d1f,nl,False,1683273447869,1683273838336,,False,,,True
ee42419f-93fc-4512-9745-c1202064dcec,"Aantal oprichtingen van btw-plichtige ondernemingen volgens economische activiteit en werknemersklasse, meest recente jaar",True,,a3ca8eba-26ab-4320-87ea-cac420ada915,nl,False,1447144582724,1664955568181,,False,,,True
32f8d894-4e79-4f3b-9b1d-85c7f1b53062,Laatste gebruik van internet per geslacht,True,,15c7ce24-4c77-4a45-aeb8-5f96d02b3ba4,nl,False,1608202018852,1671199927466,0.0,False,,,True
069b893a-5ccd-4180-bf1b-6ded388604fd,Gemeenten met het grootste aandeel inwoners met een nationaliteit van een land buiten de Europese Unie,True,,06deb4bd-8f91-49fb-befb-cfb25108b5ae,nl,False,1455711331485,1463142591575,,False,,,True
032d4cb3-1e26-43a2-8b54-905ef6191369,Gemeenten waarvan het aandeel van de bevolking dat in de loop van 2010 naar zijn huidige woning verhuisde het hoogst was,True,,06deb4bd-8f91-49fb-befb-cfb25108b5ae,nl,False,1455713565467,1463142735381,,False,,,True
68357ad2-ab7e-4959-916e-1d0f36606ea3,"Gebruik van andere zuivelproducten op basis van koemelk, maandproducties per product - 13 laatste maanden",True,,2c6ac768-b5fc-46ff-a599-8a102940ccb2,nl,False,1548066048223,1591874619755,,False,,,True
9f350f01-b2d3-4f1a-9bfb-2869ba7bd833," Aantal opgerichte, actieve en verdwenen BTW-plichtige ondernemingen volgens economische activiteit, België en gewesten, 2007",True,,54162165-69a7-41e9-9c28-b9f10172a64f,nl,False,1447082164721,1619172289230,,False,,,True
5209396e-ed11-45d2-b873-5f45f60ebeba,"Banenverlies voor België en gewesten, laatste 12 jaar",True,,afdecf03-f4dd-4e0f-9a8d-faa55be83259,nl,False,1674119502995,1674124626567,,False,,,True
5525fea5-4abb-424b-918c-d5a5658b9e34,"Bevolking per geslacht en nationaliteit voor België en gewesten, 2012 en 2022",True,,65ee413b-3859-4c6f-a847-09b631766fa7,nl,False,1655296081604,1655360058436,,False,,,True
645e9857-8fd4-478b-989a-1ed96c348a0a,Table from HC01_6 (NL),True,,cb66d618-af5a-4da9-a0bb-d59572152495,nl,False,1443454620632,1452584836932,,False,,,True
2a61e14d-e68e-40da-b0f8-297fff2027ee,Table from HC20_3 (NL),True,,633aff87-1006-4854-98fe-8e03c07dc973,nl,False,1443454620632,1452674529884,,False,,,True
ad535027-1e63-4eee-88cb-c271bea7e590,Maandelijkse stroom van Btw-plichtige ondernemingen volgens ondernemingstype laatste 13 maanden,True,,9465cc86-06bd-48ec-a8f5-4907385a5d0b,nl,False,1647869846314,1647945642168,,False,,,True
77f615b9-ab4e-4f24-8b10-fe017c2dd314,Table from HC41_6 (NL),True,,64fd6100-801a-49d3-ae6d-bd00092a1d4e,nl,False,1446816790362,1452675646170,,False,,,True
98d704f1-0a0a-40ee-8945-dd5453eddd7c,"Bodembezetting volgens het Kadasterregister, België, 2022",True,,8d2bc802-9b5b-4679-820c-0a7172827e13,nl,False,1668673399554,1668673787792,,False,,,True
995b25fb-3eef-40b4-bb26-9c5e0690071a,Gemeenten met het kleinste aandeel inwoners met een nationaliteit van een land buiten de Europese Unie,True,,06deb4bd-8f91-49fb-befb-cfb25108b5ae,nl,False,1455711448649,1463142631860,,False,,,True
2bd302a0-aa37-4c26-afda-1a88f3387d1e,"Computerapparatuur van bedrijven per regio en grootteklasse, laatste 4 jaar",True,,b24bd07e-6209-47ed-9822-4a503d5cb0e7,nl,False,1452453387355,1575547738695,,False,,,True
7085852c-ee0f-4abf-a011-f87e5122049e,Gemeenten met het laagste aandeel vijfenzestigplussers,True,,06deb4bd-8f91-49fb-befb-cfb25108b5ae,nl,False,1455690749692,1463142677940,,False,,,True
521c8e92-10cf-4b43-8711-3d973005d98c,"Detailhandel Bruto-index en tendens (gedeflateerd) , laatste 4 maanden",True,,5d3c2e37-d883-41fe-8c2f-fe8768353aa6,nl,False,1669389254914,1669389642736,,False,,,True
da4dc0af-2143-4504-a81d-6144d193027d,Table from HC46_6 (NL),True,,09a62a03-b4d7-4627-a246-04dbcb818855,nl,False,1446818210353,1452676941221,,False,,,True
e1f00e24-77a5-4dd5-8c79-154213abab25,"Aantal faillissementen volgens grootteklasse, laatste 13 maanden",True,,afdecf03-f4dd-4e0f-9a8d-faa55be83259,nl,False,1560328842669,1674117171099,,False,,,True
949dc7cc-44b7-4833-b87e-d767f8582c83,Gemeenten met het laagste aandeel buitenlanders,True,,06deb4bd-8f91-49fb-befb-cfb25108b5ae,nl,False,1455711190193,1463142631860,,False,,,True
04705e27-ff33-4088-8d5c-ac40974e8fa3,"Aantal actieve btw-plichtige ondernemingen volgens economische activiteit en werknemersklasse, meest recente jaar",True,,a3ca8eba-26ab-4320-87ea-cac420ada915,nl,False,1537969964333,1664955568181,0.0,False,,,True
e10ca3a9-6ee7-478e-9b5b-d2aadb36cd13,Gemeenten waar het aandeel van de bevolking met een diploma van het hoger onderwijs het grootst is,True,,06deb4bd-8f91-49fb-befb-cfb25108b5ae,nl,False,1455691678043,1463142735381,,False,,,True
577e7eeb-dc77-4461-b190-9164ad1da877,"Werkgelegenheids-, werkloosheids- en activiteitsgraad per geslacht voor België en Gewesten, per kwartaal",True,,f0487d44-2b45-427c-b2ce-890196a728c4,nl,False,1525684121362,1664284473589,0.0,False,,,True
b641b5de-5e47-432f-b6cd-d51857ca36cd,"Bevolking per geslacht en per burgerlijke staat voor België, 2012 en 2022",True,,65ee413b-3859-4c6f-a847-09b631766fa7,nl,False,1655296163928,1655360058436,,False,,,True
0313ec83-a40f-483f-a134-4bda701a9d34,Table from HC08_3 (NL),True,,f40551e0-fcc9-459a-9969-b4c177c0f18a,nl,False,1443454620632,1452606606709,,False,,,True
896fc494-fa50-43d7-bf7b-a88d2574e29b,"Geslachtsverhouding: België, regio’s, provincies",True,,06deb4bd-8f91-49fb-befb-cfb25108b5ae,nl,False,1447836313021,1463142735381,,False,,,True
d4c038a1-ba97-47c7-8ae2-9a10d929f4c1,"Consumptieprijsindexen volgens 12 groepen, laatste 13 maanden",True,,91fdb63f-55a3-412c-b26f-652b5b53955b,nl,False,1447066086562,1450362073575,,False,,,True
f291af08-9cb5-42d0-aba4-9edd4252806d,Table from HC06_2 (NL),True,,cd4b838b-76a6-4797-ae72-079c7800abd1,nl,False,1443454620632,1452605954491,,False,,,True
45eeed0e-6189-40db-ae21-e828b480f789,"Aandeel gehuwden : België, regio’s, provincies",True,,06deb4bd-8f91-49fb-befb-cfb25108b5ae,nl,False,1455695806659,1463141654561,,False,,,True
805f5552-168a-4c60-bae4-12f636230ded,Table from HC08_2 (NL),True,,53a108a6-800f-4872-9555-c97cbeb29c5e,nl,False,1443454620632,1452606606709,,False,,,True
f182be67-610f-4b05-90cb-f42f5938c448,"Totale bevolking : België, regio’s, provincies",True,,06deb4bd-8f91-49fb-befb-cfb25108b5ae,nl,False,1447147999893,1463142782129,,False,,,True
68c62d3c-c520-44b0-9c96-a0dff87cf460,Actieve onderneming naar rechtsvorm,True,,94ecc518-2e49-402f-beb9-f8224c747b60,nl,False,1620811753240,1637323872521,,False,,,True
d13bc461-f478-4ebd-ad20-7a48d7fe035b,"Aandeel van de bewoonde conventionele woningen gebouwd vanaf 1991 : België, de gewesten en de provincies",True,,06deb4bd-8f91-49fb-befb-cfb25108b5ae,nl,False,1455715040441,1463141782453,,False,,,True
9cca3f3e-e028-461e-ad34-260ac9af74c5,Gemeenten waar het aandeel van de bewoonde conventionele woningen gebouwd vanaf 1991 het laagst is,True,,06deb4bd-8f91-49fb-befb-cfb25108b5ae,nl,False,1455715202432,1463142735381,,False,,,True
480767ad-2150-446c-9034-df8c50b0497f,Table from HC50 (NL),True,,c6f23b1f-62cb-4443-abed-be34bffd15e3,nl,False,1447762261410,1452677113509,,False,,,True
f88e1825-df53-43b8-b1a4-bced8f655205,"Index van de prijzen aan de producent van land- en tuinbouwproducten voor België, laatste 6 jaar",True,,79a98414-d614-48d7-9bda-e221eb472a2e,nl,False,1615197832235,1617807187628,,False,,,True
6af8b669-9e17-4cb3-8e71-99c2236e362c,"Aantal stopzettingen van btw-plichtige ondernemingen volgens werknemersklasse en plaats maatschappelijke zetel, meest recente jaar",True,,a3ca8eba-26ab-4320-87ea-cac420ada915,nl,False,1447144507950,1664955568181,,False,,,True
ba302df9-dfef-4511-a2ef-c36b43e27bd6,"Aandeel van de bewoonde conventionele woningen gebouwd vanaf 2001 : België, de gewesten en de provincies",True,,06deb4bd-8f91-49fb-befb-cfb25108b5ae,nl,False,1455715316708,1463141782453,,False,,,True
9cbae079-22b2-44d1-aac6-cace3063d18d,Frequentie van het internetgebruik tijdens de laatste drie maanden,True,,7a74849e-2186-4ee8-90f9-80521455fe12,nl,False,1513160905053,1671199927466,,False,,,True
c8db2209-a9c7-4b01-ae90-9628d71b8b3a,"Geharmoniseerde index van de consumptieprijzen en inflatie, laatste 12 maanden",True,,ca6de3b0-e6c1-4c66-8a3a-f608497d5ac5,nl,False,1564034126269,1618472841528,,False,,,True
61d97344-b057-4a04-8cae-768e70749615,"Inflatie berekend op de geharmoniseerde index van de consumptieprijzen volgens groep producten en diensten, laatste 12 maanden",True,,ca6de3b0-e6c1-4c66-8a3a-f608497d5ac5,nl,False,1452682087136,1618472841528,,False,,,True
74a58289-dc7e-446d-954b-a0609a6a2d9b,Table from HC32 (NL),True,,d670ccf6-6dd0-4bc7-9c83-e68e1a527cc9,nl,False,1443454620632,1452675174826,,False,,,True
0e522c9f-899b-4893-ac2a-03bffc032cbe,Gemeenten met het hoogste aandeel inwoners geboren in een land van de Europese Unie (België uitgezonderd),True,,06deb4bd-8f91-49fb-befb-cfb25108b5ae,nl,False,1455712711579,1463142591575,,False,,,True
23eb5c23-9e43-4045-9690-e435838e4416,Gemeenten waarvan het aandeel van de bevolking dat in de loop van 2010 naar zijn huidige woning verhuisde het laagst was,True,,06deb4bd-8f91-49fb-befb-cfb25108b5ae,nl,False,1455713648494,1463142735381,,False,,,True
970cc107-ea33-4237-925b-d35a2f6a0cd0,"Aandeel woningen bewoond door de eigenaar: België, regio’s, provincies",True,,06deb4bd-8f91-49fb-befb-cfb25108b5ae,nl,False,1455714570942,1463141893201,,False,,,True
9578566f-5fb3-42e0-b9f9-ad5e6fbdd993,Gemeenten met het laagste aandeel koppels zonder kinderen,True,,06deb4bd-8f91-49fb-befb-cfb25108b5ae,nl,False,1455695259892,1463142677940,,False,,,True
0939a6d7-b63e-441f-93ed-89fcf91e6bd3,"Afzetprijsindexen voor de industrie (zonder bouw) voor de binnen- en buitenlandse markten, laatste 13 maanden",True,,69139733-0349-4d6b-b54c-ae78cb7f6a90,nl,False,1510223436920,1619017385119,,False,,,True
2bbbb960-bec5-45fb-ae4e-776ed12b1537,"Aandeel inwoners geboren buiten de EU27 (België uitgezonderd): België, regio’s, provincies",True,,06deb4bd-8f91-49fb-befb-cfb25108b5ae,nl,False,1455713206039,1463141684903,,False,,,True
0d2c814c-d204-43db-a843-e0097354723b,Table from HC56 (NL),True,,9a0066c0-2682-4db4-b8f7-9d4501fac8ad,nl,False,1447762853879,1452677360879,,False,,,True
3020c6c2-5409-477a-b27f-83439245da34,Table from HC23_3 (NL),True,,b895e626-a5a6-4b8b-8885-3f5b121e3fc1,nl,False,1443454620632,1452674725147,,False,,,True
c711621c-4fac-4ebd-95a3-2b8ac3853c50,Gemeenten met het grootste aandeel inwoners jonger dan 15 jaar,True,,06deb4bd-8f91-49fb-befb-cfb25108b5ae,nl,False,1455689631663,1463142553814,,False,,,True
44b69928-549d-467d-9942-70349c6b2080,Table from HC12_6 (NL),True,,d63b902c-11d0-429a-b4d5-3c2bf7d59cce,nl,False,1443454620632,1452614377659,,False,,,True
