id,name,standard,ownerId,dataSourceId,locale,inapplicable,lastChangeDate,lastPublishDate,order,selected,note,dataSourceCitation,published
8b82b79e-4696-45ec-a082-254756db6be6,"Actieve (werkende en werkloze) en inactieve bevolking op basis van de Enquête naar de ArbeidsKrachten, per jaar, gewest, leeftijdsklasse en onderwijsniveau, 1999-2016",True,,577a64da-ea7b-4018-aab2-196693cf5dce,nl,False,1531983796733,1531985422920,,False,,,True
ea08030c-78c2-4045-9f20-e66ada7eed15,Table from HC22 (NL),True,,16af7a7f-03bd-47ba-b532-750ad02660ee,nl,False,1443454620632,1452674654203,,False,,,True
161080d2-d411-4e40-9a0f-a27db5e2b6e1,Bevolking naar geslacht en leeftijdsgroep - België 2022,True,,65ee413b-3859-4c6f-a847-09b631766fa7,nl,False,1655295459221,1655360058436,,False,,,True
d136ea24-9d50-421e-871a-7b807d163236,Beschikbaarheid van internet in het huishouden per gewest,True,,d0ffd91e-2c69-4105-90fd-d92c2d4c1bd5,nl,False,1608201942752,1671199927466,0.0,False,,,True
61d55a29-8b10-4916-9877-0825e875fffc,Table from HC35 (NL),True,,6ec75991-1c08-452a-a7cb-1cfb0a413784,nl,False,1446633292439,1452675356587,,False,,,True
ba50cc5f-60c8-4662-9edd-94f636f85b8e,Energie gebruiksstatistieken - Globale energiebalans 2021,True,,0e22d3ca-1721-4f98-80a9-df41ab32e72b,nl,False,1671178269251,1671179230813,,False,,,True
75a909d4-cbba-4a5d-9cd0-0a4d8439193f,Gemeenten met de hoogste afhankelijkheidsgraad van ouderen,True,,06deb4bd-8f91-49fb-befb-cfb25108b5ae,nl,False,1455691109202,1463142477741,,False,,,True
3faef1fa-ebca-4657-be57-ecf313ad4d04,Gemeenten met de meeste particuliere huishoudens,True,,06deb4bd-8f91-49fb-befb-cfb25108b5ae,nl,False,1453816500533,1463142553814,,False,,,True
693108e1-819d-413c-a8f1-d61a7a2962bd,Table from HC25_8 (NL),True,,8da928e1-ef95-4cf5-bc74-c18745d2c391,nl,False,1443454620632,1452674940170,,False,,,True
8eeb4993-d107-4766-87e8-b3073b9041bf,Gemeenten met het kleinste aandeel van de werkende bevolking die buiten de provincie van de woonplaats werkt,True,,06deb4bd-8f91-49fb-befb-cfb25108b5ae,nl,False,1455711889325,1463142631860,,False,,,True
